id,title,score,num_comments,author,created_utc,url,over_18,edited,spoiler,stickied
1c0uf21,And so it begins. Databricks just couldn't help themselves. Get your wallets out.,141,101,dataengineeringdude,2024-04-10 19:38:20,https://www.reddit.com/r/dataengineering/comments/1c0uf21/and_so_it_begins_databricks_just_couldnt_help/,False,False,False,False
1c0qaxv,A year into building a data project,53,14,digitalghost-dev,2024-04-10 16:50:11,https://www.reddit.com/r/dataengineering/comments/1c0qaxv/a_year_into_building_a_data_project/,False,False,False,False
1c0gzxt,1 and a half years with no proper experience,24,8,Solid-Sloth,2024-04-10 08:56:15,https://www.reddit.com/r/dataengineering/comments/1c0gzxt/1_and_a_half_years_with_no_proper_experience/,False,False,False,False
1c0k5xk,Rant of a data professional,25,14,Benmagz,2024-04-10 12:17:55,https://www.reddit.com/r/dataengineering/comments/1c0k5xk/rant_of_a_data_professional/,False,False,False,False
1c0gboa,Synapse notebooks don't run in parallel,17,19,drollerfoot7,2024-04-10 08:06:01,https://www.reddit.com/r/dataengineering/comments/1c0gboa/synapse_notebooks_dont_run_in_parallel/,False,False,False,False
1c09xqn,Current analyst wanting to go into data engineering. Am I in a bad situation?,14,16,veganmeat,2024-04-10 01:56:44,https://www.reddit.com/r/dataengineering/comments/1c09xqn/current_analyst_wanting_to_go_into_data/,False,False,False,False
1c0r1l9,Why Matillion with Snowflake?,10,11,avin_045,2024-04-10 17:20:28,https://www.reddit.com/r/dataengineering/comments/1c0r1l9/why_matillion_with_snowflake/,False,False,False,False
1c09o99,Alternative for Cloud Function?,8,7,Koninhooz,2024-04-10 01:43:55,https://www.reddit.com/r/dataengineering/comments/1c09o99/alternative_for_cloud_function/,False,False,False,False
1c0hdho,Programming with DuckDB vs Pandas,6,8,CharacterScience,2024-04-10 09:23:54,https://www.reddit.com/r/dataengineering/comments/1c0hdho/programming_with_duckdb_vs_pandas/,False,False,False,False
1c094p3,Experimenting with Polars: Indexing Exploding Columns,5,2,EngiNerd9000,2024-04-10 01:17:58,https://www.reddit.com/r/dataengineering/comments/1c094p3/experimenting_with_polars_indexing_exploding/,False,False,False,False
1c0o54t,a list of ai analytics tools,5,0,rickradewagen,2024-04-10 15:20:18,https://www.reddit.com/r/dataengineering/comments/1c0o54t/a_list_of_ai_analytics_tools/,False,False,False,False
1c0jvi4,snowflake ci/cd,5,2,87keicam,2024-04-10 12:02:46,https://www.reddit.com/r/dataengineering/comments/1c0jvi4/snowflake_cicd/,False,False,False,False
1c0o4s2,Masking PII with Stateful Service Composition and Fluvio Streams,4,0,drc1728,2024-04-10 15:19:54,https://infinyon.com/blog/2024/04/mask-pii-stateful-streaming,False,False,False,False
1c09748,"Experience in programming, extracting, cleaning multi-TB datasets",3,1,UrbanCrusader24,2024-04-10 01:21:02,https://www.reddit.com/r/dataengineering/comments/1c09748/experience_in_programming_extracting_cleaning/,False,False,False,False
1c0yckq,Alternative to Unity Catalog,3,2,Letmeout1,2024-04-10 22:17:45,https://www.reddit.com/r/dataengineering/comments/1c0yckq/alternative_to_unity_catalog/,False,False,False,False
1c0y1eg,Databricks and DBT; would it have been better to simply use dbt-core over pyspark?,3,7,50mm_foto,2024-04-10 22:05:08,https://www.reddit.com/r/dataengineering/comments/1c0y1eg/databricks_and_dbt_would_it_have_been_better_to/,False,False,False,False
1c0tanl,Building a Data Lakehouse in BigQuery - best practices?,2,1,PuddingGryphon,2024-04-10 18:52:56,https://www.reddit.com/r/dataengineering/comments/1c0tanl/building_a_data_lakehouse_in_bigquery_best/,False,False,False,False
1c0kywe,using ansible to sync git repo on VM with remote host,3,5,johnsonfrusciante,2024-04-10 12:58:38,https://www.reddit.com/r/dataengineering/comments/1c0kywe/using_ansible_to_sync_git_repo_on_vm_with_remote/,False,False,False,False
1c0k56s,Setting up a data model,3,2,ProfessionalReport99,2024-04-10 12:16:46,https://www.reddit.com/r/dataengineering/comments/1c0k56s/setting_up_a_data_model/,False,False,False,False
1c11nfb,Using Python and Pandas to calculate net issuance of U.S. treasury securities,3,0,dharmatech,2024-04-11 00:44:09,https://v.redd.it/31knaxx8yqtc1,False,False,False,False
1c1021w,I need design suggestions for a major overhaul. What are some good ways to implement checkpoints / date control in Pyspark - Hadoop ETL pipelines?,2,5,knightfall0,2024-04-10 23:30:46,https://www.reddit.com/r/dataengineering/comments/1c1021w/i_need_design_suggestions_for_a_major_overhaul/,False,False,False,False
1c0ofix,Best practice to develop derived attributes in DWH? Aggregated Facts as Dimension Attributes - Dimensional Modeling,2,3,Kindly-Screen-2557,2024-04-10 15:32:14,https://www.reddit.com/r/dataengineering/comments/1c0ofix/best_practice_to_develop_derived_attributes_in/,False,False,False,False
1c0n6pv,Python tool like pgdiff but for comparing the schemas of two Postgres tables,2,0,PrinceOfBeauty,2024-04-10 14:39:35,https://www.reddit.com/r/dataengineering/comments/1c0n6pv/python_tool_like_pgdiff_but_for_comparing_the/,False,False,False,False
1c0lnss,How to organize many config files?,2,1,uselesstrashhh,2024-04-10 13:31:32,https://www.reddit.com/r/dataengineering/comments/1c0lnss/how_to_organize_many_config_files/,False,False,False,False
1c0j83e,Taps & Targets: Simplify ETL Through Singer's Data Pipeline Blueprint,2,1,ivanovyordan,2024-04-10 11:25:33,https://datagibberish.com/p/singer-101?r=odlo3,False,False,False,False
1c0ioz8,Help me with my etl system,2,1,Ordinary_Run_2513,2024-04-10 10:52:59,https://www.reddit.com/r/dataengineering/comments/1c0ioz8/help_me_with_my_etl_system/,False,False,False,False
1c0ca07,Need some help regarding data engineering projects...,2,1,LucaMarko,2024-04-10 03:53:05,https://www.reddit.com/r/dataengineering/comments/1c0ca07/need_some_help_regarding_data_engineering_projects/,False,False,False,False
1c0ascf,Looking for my first job..,2,6,Fraiz24,2024-04-10 02:37:10,https://www.reddit.com/r/dataengineering/comments/1c0ascf/looking_for_my_first_job/,False,False,False,False
1c10vai,How to choose the Right OLAP Storage,1,0,Opiumred14,2024-04-11 00:07:31,https://www.reddit.com/r/dataengineering/comments/1c10vai/how_to_choose_the_right_olap_storage/,False,False,False,False
1c0zaze,Polars' scan_csv vs read_csv_batched,1,2,soposih_jaevel,2024-04-10 22:58:22,https://www.reddit.com/r/dataengineering/comments/1c0zaze/polars_scan_csv_vs_read_csv_batched/,False,False,False,False
1c0y2y9,Passing arguments to scala jar from a spark session,1,1,khante,2024-04-10 22:06:54,https://www.reddit.com/r/dataengineering/comments/1c0y2y9/passing_arguments_to_scala_jar_from_a_spark/,False,False,False,False
1c0vsve,Performance Analysis tools for a Step Function Flow ?,1,0,vandelay82,2024-04-10 20:33:18,https://www.reddit.com/r/dataengineering/comments/1c0vsve/performance_analysis_tools_for_a_step_function/,False,False,False,False
1c0v01p,APIs to BigQuery Pipeline - thoughts required,1,0,AhmidAziz,2024-04-10 20:01:25,https://www.reddit.com/r/dataengineering/comments/1c0v01p/apis_to_bigquery_pipeline_thoughts_required/,False,False,False,False
1c0t712,Assessment,1,0,ZephyrGlimmer,2024-04-10 18:48:48,https://www.reddit.com/r/dataengineering/comments/1c0t712/assessment/,False,False,False,False
1c0syna,Efficient data model,1,0,laterunner-3,2024-04-10 18:39:15,https://www.reddit.com/r/dataengineering/comments/1c0syna/efficient_data_model/,False,False,False,False
1c0qhrc,Task Monitoring in snowflake ,1,1,New_Mechanic_9502,2024-04-10 16:57:56,https://www.reddit.com/r/dataengineering/comments/1c0qhrc/task_monitoring_in_snowflake/,False,False,False,False
1c0ffed,Schema / DB Complexity Metrics,1,0,schubidubidubid,2024-04-10 07:02:50,https://www.reddit.com/r/dataengineering/comments/1c0ffed/schema_db_complexity_metrics/,False,False,False,False
1c0zb08,Databricks taking long time to save pyspark dataframe as a delta table,0,4,bongdong42O,2024-04-10 22:58:24,https://www.reddit.com/r/dataengineering/comments/1c0zb08/databricks_taking_long_time_to_save_pyspark/,False,False,False,False
1c0wscx,"Trying to switch jobs, how do I navigate the having no ""professional"" cloud experience problem?",0,4,Even_Work_7995,2024-04-10 21:14:22,https://www.reddit.com/r/dataengineering/comments/1c0wscx/trying_to_switch_jobs_how_do_i_navigate_the/,False,False,False,False
1c0qg7p,Using Streamlit (via Snowflake) as a data ingestion and update tool (versus Sigma BI tool),0,4,MasterKluch,2024-04-10 16:56:06,https://www.reddit.com/r/dataengineering/comments/1c0qg7p/using_streamlit_via_snowflake_as_a_data_ingestion/,False,False,False,False
1c0otb3,Coinbase,0,1,No_Cat_8466,2024-04-10 15:48:28,https://www.reddit.com/r/dataengineering/comments/1c0otb3/coinbase/,False,False,False,False
